{
  "hookId": "completion_evidence_check",
  "repoRoot": "hooks/claude/examples/runner-scan-fixtures/completion-evidence-finding",
  "task": {
    "type": "completion",
    "declaredBy": "agent",
    "summary": "Check that completion artifacts wait for the declared final gate evidence."
  },
  "inputs": {
    "completionDraft": "reports/completion.md",
    "commandLog": "reports/command-log.md",
    "finalGate": {
      "command": "npm run bench:check",
      "artifactPath": "release/gate.json"
    }
  }
}
