{
  "hookId": "post_edit_scope_check",
  "repoRoot": "hooks/claude/examples/runner-scan-fixtures/hardcoded-credential-finding",
  "task": {
    "type": "implementation",
    "declaredBy": "agent",
    "summary": "Check that env/config repair does not add hardcoded credential fallback behavior."
  },
  "inputs": {
    "changedFiles": ["src/config.js"]
  }
}
